{"feature_snapshot":{"schema_version":"transition-feature-snapshot/2","sha256":"2222222222222222222222222222222222222222222222222222222222222222"},"format":{"channel_order":"stereo_lr","channels":2,"sample_rate_hz":44100},"operations":[{"kind":"time_map","op_id":"incoming.time_map","profile":"pitch_preserving_balanced_transients_v1","source_rate_ppm":1020000,"target":"incoming"},{"control_interval_frames":64,"cutoff_interpolations":["linear"],"cutoff_points":[{"cutoff_millihz":18000000,"frame":-88200},{"cutoff_millihz":20000,"frame":0}],"filter_kind":"lowpass_biquad_v1","kind":"filter_envelope","op_id":"outgoing.filter","q_milli":707,"target":"outgoing","wet_interpolations":["linear"],"wet_points":[{"frame":-88200,"value_ppm":0},{"frame":0,"value_ppm":1000000}]},{"band_gain_envelopes":[{"band":"low","interpolations":["linear"],"points":[{"frame":-88200,"value_ppm":0},{"frame":0,"value_ppm":1000000}]},{"band":"high","interpolations":["linear"],"points":[{"frame":-88200,"value_ppm":1000000},{"frame":0,"value_ppm":1000000}]}],"bands":["low","high"],"control_interval_frames":64,"crossover_millihz":[200000],"kind":"crossover_band_gain","op_id":"incoming.crossover","profile":"linkwitz_riley_4_v1","target":"incoming","wet_interpolations":["linear"],"wet_points":[{"frame":-88200,"value_ppm":1000000},{"frame":0,"value_ppm":1000000}]},{"interpolations":["linear","linear"],"kind":"duck_envelope","op_id":"outgoing.duck","points":[{"frame":-88200,"value_ppm":1000000},{"frame":-70560,"value_ppm":500000},{"frame":-52920,"value_ppm":1000000}],"reason":"vocal_collision","target":"outgoing"},{"interpolations":["linear","linear"],"kind":"rhythmic_gate","op_id":"incoming.gate","points":[{"frame":-17640,"value_ppm":1000000},{"frame":-17419,"value_ppm":0},{"frame":0,"value_ppm":0}],"target":"incoming"},{"capture_end_frame":0,"capture_start_frame":-22050,"kind":"feedforward_delay_tail","op_id":"outgoing.tail","taps":[{"delay_frames":8820,"gain_ppm":300000},{"delay_frames":17640,"gain_ppm":150000}],"target":"outgoing"},{"interpolations":["linear"],"kind":"gain_envelope","op_id":"outgoing.primary_gain","points":[{"frame":-88200,"value_ppm":1000000},{"frame":0,"value_ppm":0}],"target":"outgoing"},{"interpolations":["linear"],"kind":"gain_envelope","op_id":"incoming.primary_gain","points":[{"frame":-88200,"value_ppm":0},{"frame":0,"value_ppm":1000000}],"target":"incoming"}],"output_safety":{"activity_threshold_mdb":100,"limiter_profile":"lookahead_peak_limiter_v1","lookahead_frames":221,"maximum_active_fraction_ppm":50000,"maximum_gain_reduction_mdb":3000,"pair_output_gain_mdb":-12000,"profile":"transition_output_safety_v1","release_frames":4410,"sample_peak_ceiling_mdbfs":-1200,"true_peak_measurement_profile":"bs1770_4x_v1","true_peak_target_mdbtp":-1000},"plan_id":"op1-0000000000000000000000000000000000000000000000000000000000000000","provenance":{"generator_config_sha256":"3333333333333333333333333333333333333333333333333333333333333333","generator_id":"offline-transition-generator","generator_version":"1.0.0","geometry_id":"geometry-all","seed_hex_u64":"0000000000000000"},"schema_version":"transition-operator-plan/1","sources":{"incoming":{"cue_id":"incoming-cue","cue_source_frame":441000,"pcm_frame_count":8820000,"pcm_profile":"pcm_s16le_stereo_44100_v1","pcm_sha256":"bbbbbbbbbbbbbbbbbbbbbbbbbbbbbbbbbbbbbbbbbbbbbbbbbbbbbbbbbbbbbbbb","track_id":"private-track-incoming"},"outgoing":{"cue_id":"outgoing-cue","cue_source_frame":8000000,"pcm_frame_count":8820000,"pcm_profile":"pcm_s16le_stereo_44100_v1","pcm_sha256":"aaaaaaaaaaaaaaaaaaaaaaaaaaaaaaaaaaaaaaaaaaaaaaaaaaaaaaaaaaaaaaaa","track_id":"private-track-outgoing"}},"template":{"id":"shaped_handoff","recipe_id":"all_operations_fixture","version":1},"timeline":{"dry_handoff_frame":0,"dry_start_frame":-88200,"effect_end_frame":17640}}
