{"feature_snapshot":{"schema_version":"transition-feature-snapshot/2","sha256":"2222222222222222222222222222222222222222222222222222222222222222"},"format":{"channel_order":"stereo_lr","channels":2,"sample_rate_hz":44100},"operations":[{"interpolations":["linear"],"kind":"gain_envelope","op_id":"outgoing.primary_gain","points":[{"frame":-220500,"value_ppm":1000000},{"frame":0,"value_ppm":0}],"target":"outgoing"},{"interpolations":["linear"],"kind":"gain_envelope","op_id":"incoming.primary_gain","points":[{"frame":-220500,"value_ppm":0},{"frame":0,"value_ppm":1000000}],"target":"incoming"}],"output_safety":{"activity_threshold_mdb":100,"limiter_profile":"lookahead_peak_limiter_v1","lookahead_frames":221,"maximum_active_fraction_ppm":50000,"maximum_gain_reduction_mdb":3000,"pair_output_gain_mdb":-12000,"profile":"transition_output_safety_v1","release_frames":4410,"sample_peak_ceiling_mdbfs":-1200,"true_peak_measurement_profile":"bs1770_4x_v1","true_peak_target_mdbtp":-1000},"plan_id":"op1-73a89d840145c1404737b89c932b1c90e1f351cad6815a57f7f63fb775dc381f","provenance":{"generator_config_sha256":"3333333333333333333333333333333333333333333333333333333333333333","generator_id":"offline-transition-generator","generator_version":"1.0.0","geometry_id":"geometry-safe","seed_hex_u64":"0000000000000000"},"schema_version":"transition-operator-plan/1","sources":{"incoming":{"cue_id":"incoming-cue","cue_source_frame":441000,"pcm_frame_count":8820000,"pcm_profile":"pcm_s16le_stereo_44100_v1","pcm_sha256":"bbbbbbbbbbbbbbbbbbbbbbbbbbbbbbbbbbbbbbbbbbbbbbbbbbbbbbbbbbbbbbbb","track_id":"private-track-incoming"},"outgoing":{"cue_id":"outgoing-cue","cue_source_frame":8000000,"pcm_frame_count":8820000,"pcm_profile":"pcm_s16le_stereo_44100_v1","pcm_sha256":"aaaaaaaaaaaaaaaaaaaaaaaaaaaaaaaaaaaaaaaaaaaaaaaaaaaaaaaaaaaaaaaa","track_id":"private-track-outgoing"}},"template":{"id":"safe_crossfade","recipe_id":"five_second_linear","version":1},"timeline":{"dry_handoff_frame":0,"dry_start_frame":-220500,"effect_end_frame":0}}